tweet_topic,user_id,user_URL,created_at,URL,tweet_text,sentiment,pos_possibility,neg_possibility,neu_possibility,state,gender,age,count_retweet,count_like,count_reply,original_status_id
covid-vaccine-australia,Jo_MacD, https://twitter.com/Jo_MacD,2020-11-25 12:22:44,https://twitter.com/i/web/status/1331423042602377218,"OK folks, let’s get something straight. COVID vaccines aren’t being recklessly “rushed” through development. We’re seeing what’s possible when research is properly funded and scientists are unshackled from the usual barriers to progress.",positive,0.908,0.0072,0.0848,Queensland,,,0,0,0,1331332016512536577
covid-vaccine-australia,smyth_rosa, https://twitter.com/smyth_rosa,2020-11-24 10:12:03,https://twitter.com/i/web/status/1331027768226717696,"RT @BowtellPeter: Morning mail: cost of Cormann OECD tilt revealed, third Covid vaccine, Destiny Deacon's art | | The Guardian#TheBelgianWa…",neutral,0.13583,0.06441,0.79976,Victoria,,,0,0,0,1330969379530366977
covid-vaccine-australia,trbram, https://twitter.com/trbram,2020-11-24 19:43:57,https://twitter.com/i/web/status/1331171690051563520,Australia has apparently eradicated COVID-19 and we are going to rollout the double-jab vaccine soon... htf. would we even know whether the vaccine solved the problem it is supposed to solve? 🤭🤭,negative,0.00245,0.89941,0.09814,,,,0,0,0,1331164513769426946
covid-vaccine-australia,2krox, https://twitter.com/2krox,2020-11-24 18:08:17,https://twitter.com/i/web/status/1331147614721429505,"In Australia, we can roll out mass #covid19 vaccination campaigns anywhere there's an outbreak -- while simultaneously inoculating the most at risk.",negative,0.02253,0.95494,0.02253,,,,0,0,0,1331146582058700801
covid-vaccine-australia,thegreatavih, https://twitter.com/thegreatavih,2020-11-24 13:23:12,https://twitter.com/i/web/status/1331075870170103809,"RT @UKTwinds: We have made a company decision today to not sell any @Qantas flights, even on a code share, following their announcement of…",negative,0.00563,0.91393,0.08044,,,,0,0,0,1330927922362933250
covid-vaccine-australia,superruserr, https://twitter.com/superruserr,2020-11-24 20:07:29,https://twitter.com/i/web/status/1331177612002123776,My parents will probably get the first vaccine rounds by the first quarter due to their work https://t.co/tUQ1CZL6Sb  Don't plan now because it's still going to be problematic doing overseas travel because of the incoming travel caps.,negative,0.01167,0.67551,0.31282,,,,0,0,0,
covid-vaccine-australia,whereisdaz, https://twitter.com/whereisdaz,2020-11-24 15:24:17,https://twitter.com/i/web/status/1331106340907884544,"Safety is such an important part of Qantas’ business, it makes sense that they’d extend this to mandating that their passangers be vaccinated against COVID. Makes me feel a lot more comfortable about flying with them. https://t.co/vNvF779eiJ",negative,0.01163,0.97675,0.01163,New South Wales,,,1,90,0,
covid-vaccine-australia,whereisdaz, https://twitter.com/whereisdaz,2020-11-25 06:21:02,https://twitter.com/i/web/status/1331332016512536577,"OK folks, let’s get something straight. COVID vaccines aren’t being recklessly “rushed” through development. We’re seeing what’s possible when research is properly funded and scientists are unshackled from the usual barriers to progress.",positive,0.908,0.0072,0.0848,New South Wales,,,286,2501,0,
covid-vaccine-australia,crikey_news, https://twitter.com/crikey_news,2020-11-22 17:45:01,https://twitter.com/i/web/status/1330416981875564546,Finding a vaccine is just the beginning. The delivery will be every bit as critical https://t.co/quthkqQj16,neutral,0.15796,0.05033,0.79171,,,,0,5,0,
covid-vaccine-australia,Dralia_p, https://twitter.com/Dralia_p,2020-11-25 13:21:10,https://twitter.com/i/web/status/1331437748603875329,"OK folks, let’s get something straight. COVID vaccines aren’t being recklessly “rushed” through development. We’re seeing what’s possible when research is properly funded and scientists are unshackled from the usual barriers to progress.",positive,0.908,0.0072,0.0848,New South Wales,,,0,0,0,1331332016512536577
covid-vaccine-australia,Melway_27_J3, https://twitter.com/Melway_27_J3,2020-11-24 20:37:58,https://twitter.com/i/web/status/1331185284826816513,"RT @nytimes: Australia’s largest airline, Qantas, plans to require proof of vaccination for passengers who want to fly internationally once…",neutral,0.04698,0.42111,0.53192,,,,0,0,0,1331183790979493891
covid-vaccine-australia,CraigJamesMosti, https://twitter.com/CraigJamesMosti,2020-11-25 11:51:22,https://twitter.com/i/web/status/1331415149794775041,@LisaBurges4 @disclosetv Haven’t Australia made it mandatory for the COVID vaccine as well? 🤔,negative,0.01014,0.59397,0.39589,,,,0,0,0,1331333728589647872
covid-vaccine-australia,newscomauHQ, https://twitter.com/newscomauHQ,2020-11-22 17:05:00,https://twitter.com/i/web/status/1330406912110645249,Hopes for a speedy coronavirus vaccine have been boosted with announcements that two potential candidates are more than 90 per cent effective. But are they really safe? https://t.co/edKPNy5VJX,neutral,0.3221,0.1179,0.56,,,,0,8,0,
covid-vaccine-australia,newscomauHQ, https://twitter.com/newscomauHQ,2020-11-25 07:27:59,https://twitter.com/i/web/status/1331348864595464192,"There's excitement around the possibility of a coronavirus vaccines but what is the new technology behind the Moderna and Pfizer vaccines, and is it safe? https://t.co/6WEPp1MKBA",neutral,0.14589,0.13761,0.7165,,,,0,0,0,1331346107234885632
covid-vaccine-australia,LouiseWedgwood, https://twitter.com/LouiseWedgwood,2020-11-24 17:28:12,https://twitter.com/i/web/status/1331137527462338560,"RT @AusBT: ICYMI: Qantas CEO flags mandatory COVID-19 vaccination for passengers on international flights, whether you’re an arriving visit…",neutral,0.10159,0.40102,0.49739,,,,0,0,0,1330979198895149056
covid-vaccine-australia,ravirockks, https://twitter.com/ravirockks,2020-11-25 06:31:50,https://twitter.com/i/web/status/1331334734362730496,"OK folks, let’s get something straight. COVID vaccines aren’t being recklessly “rushed” through development. We’re seeing what’s possible when research is properly funded and scientists are unshackled from the usual barriers to progress.",positive,0.908,0.0072,0.0848,,,,0,0,0,1331332016512536577
covid-vaccine-australia,noisycupboard, https://twitter.com/noisycupboard,2020-11-24 11:38:51,https://twitter.com/i/web/status/1331049609167216640,"RT @AFP: International air travellers will need to be vaccinated against Covid-19 to fly with Australia's Qantas, the airline's CEO has sai…",neutral,0.04844,0.43586,0.5157,Queensland,,,0,0,0,1331039450793713665
covid-vaccine-australia,wiv31l, https://twitter.com/wiv31l,2020-11-24 06:32:29,https://twitter.com/i/web/status/1330972511299719169,"The AstraZeneca-Oxford #vaccine announcement interesting coz it seems this will be the one for #Australia, it apparently requires no “cold chain” infrastructure with -70C for storage/transport, it involves a half then full dose. We shall see. #covid19  https://t.co/3jNivfOOUU",neutral,0.175,0.10118,0.72381,,,,0,0,0,1330971084728897536
covid-vaccine-australia,standefer, https://twitter.com/standefer,2020-11-24 13:43:00,https://twitter.com/i/web/status/1331080851992567810,@GregHuntMP has announced #covid19aus vaccines will be available in March: - free - non mandatory - available to all - elderly and healthcare workers prioritised #covid19aus    https://t.co/haLdd2dNOW,neutral,0.31874,0.08031,0.60095,Victoria,,,0,0,0,1331078213301243904
covid-vaccine-australia,sujatin, https://twitter.com/sujatin,2020-11-25 08:20:13,https://twitter.com/i/web/status/1331362009108111361,"OK folks, let’s get something straight. COVID vaccines aren’t being recklessly “rushed” through development. We’re seeing what’s possible when research is properly funded and scientists are unshackled from the usual barriers to progress.",positive,0.908,0.0072,0.0848,Western Australia,,,0,0,0,1331332016512536577
covid-vaccine-australia,7NewsSydney, https://twitter.com/7NewsSydney,2020-11-24 11:28:41,https://twitter.com/i/web/status/1331047049966489604,"Australia could have an effective COVID vaccine ready by March 2021, with Federal Health Minister @GregHuntMP praising the promising new results for the Oxford University vaccine. @olivialeeming #auspol #7NEWS https://t.co/AuUs4wtycV",positive,0.84786,0.0143,0.13785,New South Wales,,,0,13,0,
covid-vaccine-australia,Gabetrotter1, https://twitter.com/Gabetrotter1,2020-11-24 20:09:08,https://twitter.com/i/web/status/1331178026516635648,Fair! It's also the right thing to do.   https://t.co/bEZ7gnpqm1,positive,0.90088,0.00474,0.09437,,,,0,0,0,
covid-vaccine-australia,AdvertiserBiz, https://twitter.com/AdvertiserBiz,2020-11-24 09:46:43,https://twitter.com/i/web/status/1331021392179937280,"AstraZeneca has vowed to sell the Oxford vaccine at cost price worldwide, with Australia on track for the first doses in March after proving 90 per cent effective. https://t.co/yYOeRkbCpZ",positive,0.78636,0.02696,0.18668,South Australia,,,0,0,0,
covid-vaccine-australia,Simmotravels, https://twitter.com/Simmotravels,2020-11-23 20:38:22,https://twitter.com/i/web/status/1330822996101976066,"RT @AusBT: Qantas CEO flags mandatory COVID-19 vaccination for passengers on international flights, whether you’re an arriving visitor or a…",neutral,0.16319,0.3169,0.51991,New South Wales,,,0,0,0,1330822472719953921
covid-vaccine-australia,kate_in_aus, https://twitter.com/kate_in_aus,2020-11-25 10:49:41,https://twitter.com/i/web/status/1331399625530478592,"Pharmaceutical giants control #Covid #vaccine patents, driving up their profits &amp; restricting supply to a few rich countries. In days govts will vote on a plan to suspend #patents so the whole world can benefit. Join the call for a vaccine for all: https://t.co/9L9aq1Cp1r",positive,0.53909,0.05602,0.40489,Tasmania,,,0,0,0,
covid-vaccine-australia,dreamingofmelb, https://twitter.com/dreamingofmelb,2020-11-24 17:31:42,https://twitter.com/i/web/status/1331138408761098241,Qantas will ban travellers who don't have the COVID vaccine — can other businesses follow suit? https://t.co/u7FsQvm7uH,negative,0.01749,0.63765,0.34486,,,,0,0,0,1331080501222785025
covid-vaccine-australia,voodoo47, https://twitter.com/voodoo47,2020-11-24 08:29:28,https://twitter.com/i/web/status/1331001949936709632,@GuardianAus I thought about this....when I was a kid it was compulsory to have a smallpox &amp; cholera jab (I still bear the mark after 56 years) but it was necessary to come to Australia so we did it.  I really don't see making the CoVid vaccine a compulsory part of air travel as a bad thing,negative,0.01525,0.57272,0.41203,,,,0,5,0,1331001235135229960
covid-vaccine-australia,cfranks_chris, https://twitter.com/cfranks_chris,2020-11-24 07:23:23,https://twitter.com/i/web/status/1330985322176335872,"#COVID19 has set the developing world back 25 years in just 25 weeks. Access to an emerging vaccine will be critical in reversing that slide.  Join us on 3 December from 1pm AEDT, to discuss how Australia can support our region to recover.  Register today⬇️https://t.co/a7xifoygbm",positive,0.64022,0.03932,0.32046,,,,0,0,0,1330732987298709504
covid-vaccine-australia,officialdimsim, https://twitter.com/officialdimsim,2020-11-25 13:24:17,https://twitter.com/i/web/status/1331438533265952768,"OK folks, let’s get something straight. COVID vaccines aren’t being recklessly “rushed” through development. We’re seeing what’s possible when research is properly funded and scientists are unshackled from the usual barriers to progress.",positive,0.908,0.0072,0.0848,,,,0,0,0,1331332016512536577
covid-vaccine-australia,LemigodMastadon, https://twitter.com/LemigodMastadon,2020-11-24 03:23:08,https://twitter.com/i/web/status/1330924857773629441,"@ali_naka This has been the sub plot all along,despite Australia having very low Covid deaths,the Corporate media inflated the cases so they can lobby for Mandatory vaccines.I called their bluff,now its come to pass.What a shame.",negative,0.00565,0.84924,0.14512,,,,0,1,0,1330918439318401025
covid-vaccine-australia,abcmelbourne, https://twitter.com/abcmelbourne,2020-11-23 08:38:06,https://twitter.com/i/web/status/1330641737212071936,'We can have a reasonably normal life between now and a vaccine': epidemiologist  https://t.co/idwBfivnXm,neutral,0.15266,0.08848,0.75886,Victoria,,,0,15,0,
covid-vaccine-australia,XavierAmouroux, https://twitter.com/XavierAmouroux,2020-11-24 05:55:05,https://twitter.com/i/web/status/1330963098694402049,"RT @AusBT: Qantas CEO flags mandatory COVID-19 vaccination for passengers on international flights, whether you’re an arriving visitor or a…",neutral,0.16319,0.3169,0.51991,,,,0,0,0,1330822472719953921
covid-vaccine-australia,esriaustralia, https://twitter.com/esriaustralia,2020-11-23 17:00:06,https://twitter.com/i/web/status/1330768067543130113,"With several COVID-19 vaccine candidates nearing the clearance stage, distribution is front-of-mind for governments around the world. Read the Q&amp;A with Dr Ori Gudes from UNSW to hear his perspective on how #geospatial technology can help: https://t.co/iwez8H9Mfq https://t.co/FSB4yutThy",positive,0.68277,0.01228,0.30495,,,,0,3,0,
covid-vaccine-australia,abcadelaide, https://twitter.com/abcadelaide,2020-11-24 14:57:03,https://twitter.com/i/web/status/1331099489717821441,Qantas will ban travellers who don't have the COVID vaccine — can other businesses follow suit? https://t.co/ANOybWXsoX,negative,0.01749,0.63765,0.34486,South Australia,,,0,9,0,
covid-vaccine-australia,johns_johnsk, https://twitter.com/johns_johnsk,2020-11-25 04:16:40,https://twitter.com/i/web/status/1331300717286440960,@sallysal111 @Wiganer100 @qldhealthnews @Smartraveller Until a vaccine enables control of this world wide pandemic I believe the 14 day quarantine coming into Aus will remain,neutral,0.04569,0.42149,0.53282,,,,0,1,0,1331241497195376641
covid-vaccine-australia,AAMRI_Aus, https://twitter.com/AAMRI_Aus,2020-11-23 18:55:04,https://twitter.com/i/web/status/1330796998568538112,Once again medical research is looking like the best investment any government can make. Decades of knowledge put to work to develop #COVID19 vaccines in record time. Thanks to all our dedicated researchers across the globe https://t.co/Omzjf2iaUl,positive,0.98636,0.00188,0.01176,Victoria,,,5,13,0,
covid-vaccine-australia,travelformotion, https://twitter.com/travelformotion,2020-11-24 03:51:01,https://twitter.com/i/web/status/1330931877021175811,"RT @BBCWorld: International air travellers will, in future, need to prove they have had Covid-19 vaccine in order to board Qantas flights,…",neutral,0.01419,0.46576,0.52005,,,,0,0,0,1330928947413078018
covid-vaccine-australia,JohnMag63102273, https://twitter.com/JohnMag63102273,2020-11-25 05:51:46,https://twitter.com/i/web/status/1331324653042765824,"Well it looks like Australians won’t be allowed to leave the country until we get the Covid vaccination, so the anti-vaxxers will be staying in Australia. So that’s good news for the rest of the world.",negative,0.00323,0.99353,0.00323,Queensland,,,0,0,0,1331164496958668800
covid-vaccine-australia,gmarimer, https://twitter.com/gmarimer,2020-11-24 09:17:51,https://twitter.com/i/web/status/1331014128136175616,"Australia on track for coronavirus vaccine by March, says Oxford University scientist - https://t.co/7WThd5NOc8",positive,0.56844,0.04552,0.38604,Victoria,,,0,0,0,
covid-vaccine-australia,6Medic, https://twitter.com/6Medic,2020-11-24 16:45:15,https://twitter.com/i/web/status/1331126720322170880,Qantas looks at smartphone app for COVID-19 'vaccine passport' https://t.co/CehWYscNeF,neutral,0.06841,0.10236,0.82923,New South Wales,,,0,0,0,
covid-vaccine-australia,6Medic, https://twitter.com/6Medic,2020-11-24 21:39:00,https://twitter.com/i/web/status/1331200644225536003,"Alan call.. Shares up 21c today, investors believe Alan is on track.. Calls surfacing to boycott Qantas over COVID vaccine mandate https://t.co/7Yulcvi7XC",positive,0.8211,0.01081,0.16809,New South Wales,,,0,0,0,
covid-vaccine-australia,RESULTS_AU, https://twitter.com/RESULTS_AU,2020-11-23 14:40:42,https://twitter.com/i/web/status/1330732987298709504,"#COVID19 has set the developing world back 25 years in just 25 weeks. Access to an emerging vaccine will be critical in reversing that slide.  Join us on 3 December from 1pm AEDT, to discuss how Australia can support our region to recover.  Register today⬇️https://t.co/a7xifoygbm",positive,0.64022,0.03932,0.32046,,,,0,2,0,
covid-vaccine-australia,Bwphantom, https://twitter.com/Bwphantom,2020-11-24 17:23:20,https://twitter.com/i/web/status/1331136300758360064,@chipfranklin Australia went into lockdown. Each country that went into lockdown COVID numbers dropped dramatically. Then continued social distancing and wearing masks. Limiting numbers in gathering. Sacrifices have to be made. Can't rely on a vaccine.,negative,0.02843,0.52694,0.44464,,,,0,0,0,1331096633115877378
covid-vaccine-australia,AustraliaPM, https://twitter.com/AustraliaPM,2020-11-23 06:15:00,https://twitter.com/i/web/status/1330605723638697990,"International travel ‘not impossible’ in 2021, with vaccine availability to affect destination: https://t.co/ixWN9VTI7I #auspol #australiapm",neutral,0.40521,0.06404,0.53074,,,,0,1,0,
covid-vaccine-australia,AustraliaPM, https://twitter.com/AustraliaPM,2020-11-24 05:52:01,https://twitter.com/i/web/status/1330962327554969603,Scott Morrison urges superpowers to wind back tensions: https://t.co/CQBKV4TuHc #auspol #australiapm,neutral,0.29235,0.04088,0.66677,,,,0,0,0,
covid-vaccine-australia,7NewsSC, https://twitter.com/7NewsSC,2020-11-24 11:28:41,https://twitter.com/i/web/status/1331047050000048130,"Australia could have an effective COVID vaccine ready by March 2021, with Federal Health Minister @GregHuntMP praising the promising new results for the Oxford University vaccine. @olivialeeming #auspol #7NEWS https://t.co/WO2O1AUTyn",positive,0.84786,0.0143,0.13785,Queensland,,,0,0,0,
covid-vaccine-australia,CommSec, https://twitter.com/CommSec,2020-11-24 11:17:25,https://twitter.com/i/web/status/1331044218622472192,"[REPORT] Mid-Session: Local shares lift by 1% as all sectors improve on vaccine hopes, low COVID numbers in Australia &amp; plans to reopen additional borders  https://t.co/8hobCPSCb2 #ausbiz https://t.co/WAergbWYAW",positive,0.62441,0.03211,0.34348,,,,0,0,0,
covid-vaccine-australia,9NewsSyd, https://twitter.com/9NewsSyd,2020-11-24 10:40:13,https://twitter.com/i/web/status/1331034853597450246,Australia is on track to have the Oxford coronavirus vaccine by March. @MarkWBurrows #AusPol #9News https://t.co/IQiAljJ05W,neutral,0.31604,0.06412,0.61984,New South Wales,,,1,8,0,
covid-vaccine-australia,9NewsSyd, https://twitter.com/9NewsSyd,2020-11-24 12:10:33,https://twitter.com/i/web/status/1331057587417096195,"We're closer than ever to a vaccine, and we'll be able to vaccinate every Australian that wants to be vaccinated, says Health Minister Greg Hunt. #9News  https://t.co/WwoK8egM3Q",positive,0.84252,0.01296,0.14453,New South Wales,,,0,0,0,1331049911111053314
covid-vaccine-australia,champy, https://twitter.com/champy,2020-11-23 17:49:59,https://twitter.com/i/web/status/1330780619874320385,"vaccine news - Oxford/AstraZeneca COVID vaccine found to be up to 90% effective in trials  this is one of 4 vaccines Australia has deals for - we have got 33.8 million doses of this one  with a 2-dose regime, that would cover 16.9 million people  https://t.co/OqCQlpGn3Q https://t.co/IcIaizecna",neutral,0.39237,0.08778,0.51984,,,,0,0,0,1330780339954876418
covid-vaccine-australia,UQ_News, https://twitter.com/UQ_News,2020-11-22 18:34:45,https://twitter.com/i/web/status/1330429499477954560,Thank you @couriermail for acknowledging the tremendous commitment and collaboration behind #UQ's #COVID19 vaccine team.🧪🔬👏👏👏👏 https://t.co/sKNxqfAGWE,positive,0.96158,0.00438,0.03404,Queensland,,,15,265,0,
covid-vaccine-australia,hp88, https://twitter.com/hp88,2020-11-23 20:40:02,https://twitter.com/i/web/status/1330823417168162821,"RT @AusBT: Qantas CEO flags mandatory COVID-19 vaccination for passengers on international flights, whether you’re an arriving visitor or a…",neutral,0.16319,0.3169,0.51991,,,,0,0,0,1330822472719953921
covid-vaccine-australia,ljayes, https://twitter.com/ljayes,2020-11-24 18:55:50,https://twitter.com/i/web/status/1331159582698205185,"RT @AFP: International travelers will need to be vaccinated against Covid-19 to fly with Australia's Qantas, the company says, the first ma…",neutral,0.10264,0.26501,0.63235,,,,0,0,0,1331159370147581952
covid-vaccine-australia,teslatrey, https://twitter.com/teslatrey,2020-11-25 02:28:08,https://twitter.com/i/web/status/1331273407967596544,Vax  Or  Never fly again   What’s your choice?  https://t.co/STTzVkR4uH,negative,0.01673,0.60681,0.37646,,,,0,0,0,1330980981109624834
covid-vaccine-australia,susiepkmelb, https://twitter.com/susiepkmelb,2020-11-24 08:55:24,https://twitter.com/i/web/status/1331008478391922694,"Anyone else in #victoria- do you feel (like myself) that we are over the worst in terms of #covid19? I think victoria and the rest of australia are well placed. If there is a vaccine coming up in a few months, I think the worst is behind us. Lucky to be here.",neutral,0.18014,0.06748,0.75238,Victoria,,,0,0,0,
covid-vaccine-australia,JohnQuiggin, https://twitter.com/JohnQuiggin,2020-11-24 13:50:22,https://twitter.com/i/web/status/1331082707279888386,"@jwilliamcarroll @PaulDOKidd I still have the scar from my smallpox vaccination, required for overseas travel in the olden days.  I didn't complain and no one else did either. We  would certainly have complained if someone demanded the freedom to bring smallpox (or Covid) into Australia (or Qld).",neutral,0.02776,0.28283,0.68941,Queensland,,,0,1,0,1331074162262122497
covid-vaccine-australia,Pony_Farts, https://twitter.com/Pony_Farts,2020-11-23 08:39:48,https://twitter.com/i/web/status/1330642164011864069,'We can have a reasonably normal life between now and a vaccine': epidemiologist  https://t.co/idwBfivnXm,neutral,0.15266,0.08848,0.75886,,,,0,0,0,1330641737212071936
covid-vaccine-australia,ctindale, https://twitter.com/ctindale,2020-11-23 19:40:27,https://twitter.com/i/web/status/1330808420853633025,"@Think_more84 @adamseconomics It mystifies me why vaccines have become so controversial . I’ve had somewhere above 12 , probably many more , you won’t be able to enter another country without a covid shot , let alone leave Australia .",neutral,0.0776,0.27131,0.65108,New South Wales,,,0,0,0,1330806051604598785
covid-vaccine-australia,9NewsMelb, https://twitter.com/9NewsMelb,2020-11-23 12:30:00,https://twitter.com/i/web/status/1330700093675229190,"Australians are in a great position to study the logistics of how other countries' coronavirus vaccine rollout progresses, a leading doctor says. #9News https://t.co/YyMYRkj6TK",positive,0.71822,0.02587,0.25591,Victoria,,,0,2,0,
covid-vaccine-australia,9NewsMelb, https://twitter.com/9NewsMelb,2020-11-24 10:35:02,https://twitter.com/i/web/status/1331033551668535297,"#BREAKING: South Australia has recorded just one new case of COVID-19, not connected to the Parafield cluster.    The person is quarantining in a medi-hotel.    Latest here: https://t.co/cFYfGqJOTx  #COVID19 #9News https://t.co/fyjojJyQtj",neutral,0.2058,0.1743,0.6199,Victoria,,,0,0,0,1331033481204420610
covid-vaccine-australia,9NewsMelb, https://twitter.com/9NewsMelb,2020-11-24 10:40:24,https://twitter.com/i/web/status/1331034902951841793,"Promising news on COVID vaccines has been coming thick and fast, and this morning there's another for us all to be excited about - Australia is on track to have the Oxford coronavirus vaccine by March. @MarkWBurrows #9News https://t.co/0WLkcQsd14",positive,0.97091,0.00341,0.02568,Victoria,,,1,7,0,
covid-vaccine-australia,9NewsMelb, https://twitter.com/9NewsMelb,2020-11-24 11:20:00,https://twitter.com/i/web/status/1331044865472221184,Health workers and the elderly will be given priority for the COVID-19 vaccine in March. #9News https://t.co/4rcdkVfig5,neutral,0.11269,0.14196,0.74535,Victoria,,,1,6,0,
covid-vaccine-australia,TheNewDailyAu, https://twitter.com/TheNewDailyAu,2020-11-24 05:58:56,https://twitter.com/i/web/status/1330964068816080896,Millions of doses of Oxford University’s coronavirus vaccine could be rolled out as soon as Christmas and Australia already has an order for 30 million doses. https://t.co/DUE0GMc0vd,positive,0.54381,0.06721,0.38898,,,,0,1,0,
covid-vaccine-australia,TheNewDailyAu, https://twitter.com/TheNewDailyAu,2020-11-24 16:15:30,https://twitter.com/i/web/status/1331119231623114752,"Foreign visitors to Australia in the future will need to be vaccinated against COVID or will be forced to quarantine, @GregHuntMP has warned. #auspol @JoshButler reports.  https://t.co/Qb4BHJGt5Q",neutral,0.05989,0.36442,0.57568,,,,0,14,0,
covid-vaccine-australia,BuzzFreeman, https://twitter.com/BuzzFreeman,2020-11-22 19:20:21,https://twitter.com/i/web/status/1330440975957757952,"@batogan08 @atma_shanti Pandemic in Australia...  0.00000096 people have the virus.  A Mandatory Vaccine.  No peer review,  warp speed, (a term that does not exist)   Science is lost, Regulatory bodies need check ups from the necks up. Pharma is truly, just a business.  PATENT CARE over PATIENT CARE. 🙏",negative,0.00346,0.91319,0.08335,,,,3,5,0,1330435820436635648
covid-vaccine-australia,kfgibson, https://twitter.com/kfgibson,2020-11-24 04:22:24,https://twitter.com/i/web/status/1330939773196795904,RT @DrEricDing: NEW—Qantas CEO Alan Joyce says you’ll need proof of vaccination against #COVID19 to be able to fly his airline internationa…,negative,0.01824,0.55589,0.42587,Western Australia,,,0,0,0,1330933031524241410
