tweet_topic,user_id,user_URL,created_at,URL,tweet_text,sentiment,pos_possibility,neg_possibility,neu_possibility,state,gender,age,count_retweet,count_like,count_reply,original_status_id
covid-vaccine-australia,rainangel23, https://twitter.com/rainangel23,2020-11-24 06:58:58,https://twitter.com/i/web/status/1330979173922340864,"@JackMaxey1 To get Australia back in the air domestically Joyce said we can’t get covid in flight because of the way the ventilation works on the aircraft.  I don’t agree with him, there are people who can’t be vaccinated, don’t want vaccination. The airlines lost billions ..doh who hasn’t",negative,0.00258,0.88872,0.1087,,,,0,1,0,1330970856630181895
covid-vaccine-australia,Frankie_Tweetz, https://twitter.com/Frankie_Tweetz,2020-11-24 23:54:31,https://twitter.com/i/web/status/1331234745477304322,"Coronavirus #mRNA vaccines could change vaccines forever   I think we'll see some pretty incredible breakthroughs based on these technologies in the future, says Larisa Labzin, an immunologist at the University of Queensland, Australia 🇦🇺  https://t.co/BhNLf1aGvx",positive,0.88359,0.0145,0.10191,New South Wales,,,0,0,0,
covid-vaccine-australia,JodieGunders, https://twitter.com/JodieGunders,2020-11-25 14:36:30,https://twitter.com/i/web/status/1331456706530795520,"OK folks, let’s get something straight. COVID vaccines aren’t being recklessly “rushed” through development. We’re seeing what’s possible when research is properly funded and scientists are unshackled from the usual barriers to progress.",positive,0.908,0.0072,0.0848,Queensland,,,0,0,0,1331332016512536577
covid-vaccine-australia,MsMountebank, https://twitter.com/MsMountebank,2020-11-25 06:30:38,https://twitter.com/i/web/status/1331334431198441472,"OK folks, let’s get something straight. COVID vaccines aren’t being recklessly “rushed” through development. We’re seeing what’s possible when research is properly funded and scientists are unshackled from the usual barriers to progress.",positive,0.908,0.0072,0.0848,Victoria,,,0,0,0,1331332016512536577
covid-vaccine-australia,CHCC_Media, https://twitter.com/CHCC_Media,2020-11-24 12:04:36,https://twitter.com/i/web/status/1331056089916264449,Promising news on #COVID19 vaccines has been coming thick and fast.   Now there's news Australia is on track to have the Oxford coronavirus vaccine by March.  @MarkWBurrows has all the details. #9News https://t.co/ncjYyXOayz,positive,0.89318,0.00859,0.09823,,,,0,0,0,1331052749820194818
covid-vaccine-australia,ovni1969, https://twitter.com/ovni1969,2020-11-05 07:40:42,https://twitter.com/i/web/status/1324104310217723905,"RT @AlisonBlunt: 30) 'With plans to make this vaccine widepsread, administed by the military (as admitted in both the US and the UK) and “a…",negative,0.04021,0.48895,0.47084,ACT,,,0,0,0,1323991977252315139
covid-vaccine-australia,micaros, https://twitter.com/micaros,2020-11-25 06:29:00,https://twitter.com/i/web/status/1331334021209440256,"OK folks, let’s get something straight. COVID vaccines aren’t being recklessly “rushed” through development. We’re seeing what’s possible when research is properly funded and scientists are unshackled from the usual barriers to progress.",positive,0.908,0.0072,0.0848,,,,0,0,0,1331332016512536577
covid-vaccine-australia,7NewsCQ, https://twitter.com/7NewsCQ,2020-11-24 11:28:41,https://twitter.com/i/web/status/1331047049958096896,"Australia could have an effective COVID vaccine ready by March 2021, with Federal Health Minister @GregHuntMP praising the promising new results for the Oxford University vaccine. @olivialeeming #auspol #7NEWS https://t.co/pFz2bH71KH",positive,0.84786,0.0143,0.13785,Queensland,,,0,0,0,
covid-vaccine-australia,AUS_Twisted, https://twitter.com/AUS_Twisted,2020-11-24 16:44:35,https://twitter.com/i/web/status/1331126550108860416,@Qantas 747 comes out of retirement with updated tail logo 🤔😡 #Qantas #COVID19 #Australia #vaccine https://t.co/MArWtuauBq,neutral,0.31831,0.0241,0.65759,,,,0,0,0,
covid-vaccine-australia,YotVam, https://twitter.com/YotVam,2020-11-25 07:25:50,https://twitter.com/i/web/status/1331348322934685697,"OK folks, let’s get something straight. COVID vaccines aren’t being recklessly “rushed” through development. We’re seeing what’s possible when research is properly funded and scientists are unshackled from the usual barriers to progress.",positive,0.908,0.0072,0.0848,,,,0,0,0,1331332016512536577
covid-vaccine-australia,TurekAndrew, https://twitter.com/TurekAndrew,2020-11-24 20:55:46,https://twitter.com/i/web/status/1331189761059405824,"Hey QANTAS,  Bunnings, Coles and Woolworths survived a pandemic with ZERO deaths ya cunts, without a Covid Vaccine and guess what? Fuck you!  IIRC our supermarkets served over 60 million customers for no COVID deaths.  *And send, to QANTAS. Best email since Dan’s Office one",negative,0.04505,0.9099,0.04505,South Australia,,,0,0,0,1331158446775754752
covid-vaccine-australia,TurekAndrew, https://twitter.com/TurekAndrew,2020-11-24 21:08:31,https://twitter.com/i/web/status/1331192970708623360,"If Australia let people fly in / out without worrying about covid , then we'd discover over time that covid was not really the big scary problem MSM &amp; politicians have beaten it up into ... hence it becomes more obvious to people that a vaccine is not needed ...",negative,0.01541,0.66517,0.31942,South Australia,,,0,0,0,1331156523276406784
covid-vaccine-australia,9HFrost, https://twitter.com/9HFrost,2020-11-24 13:24:12,https://twitter.com/i/web/status/1331076124147793920,"We're closer than ever to a vaccine, and we'll be able to vaccinate every Australian that wants to be vaccinated, says Health Minister Greg Hunt. #9News  https://t.co/WwoK8egM3Q",positive,0.84252,0.01296,0.14453,,,,0,0,0,1331049911111053314
covid-vaccine-australia,pope_penka, https://twitter.com/pope_penka,2020-11-25 08:28:32,https://twitter.com/i/web/status/1331364104376774658,"OK folks, let’s get something straight. COVID vaccines aren’t being recklessly “rushed” through development. We’re seeing what’s possible when research is properly funded and scientists are unshackled from the usual barriers to progress.",positive,0.908,0.0072,0.0848,,,,0,0,0,1331332016512536577
covid-vaccine-australia,janine_sawtell, https://twitter.com/janine_sawtell,2020-11-22 08:40:14,https://twitter.com/i/web/status/1330279882761367552,"Pfizer Asks FDA To Approve Its COVID-19 Vaccine For Emergency Use https://t.co/NrlVRBsQYA  Australia has purchased 10 million doses which will be manufactured in the United States, Belgium and Germany. That is enough to vaccinate 5 million Australians.",neutral,0.25769,0.1569,0.5854,New South Wales,,,0,0,0,1329941509215375361
covid-vaccine-australia,jacinta_bowler, https://twitter.com/jacinta_bowler,2020-11-24 12:37:11,https://twitter.com/i/web/status/1331064291282231298,"Potentially controversial opinion - I don't think Aus should get the vaccine until other countries who are fighting huge outbreaks get it. We're stuck here anyway until after the rest of the world gets COVID under control, and other places need it a lot more.",negative,0.00833,0.74923,0.24244,,,,0,0,0,
covid-vaccine-australia,MCRNBM, https://twitter.com/MCRNBM,2020-11-24 15:13:33,https://twitter.com/i/web/status/1331103642980478977,"Oxford-AstraZeneca COVID-19 vaccine result gives Australia pathway to 'normal', Government says https://t.co/rkrChZVw6U",positive,0.71567,0.02239,0.26194,New South Wales,,,0,0,0,1331050261079498754
covid-vaccine-australia,etypealicat, https://twitter.com/etypealicat,2020-11-25 07:35:13,https://twitter.com/i/web/status/1331350687062495232,"OK folks, let’s get something straight. COVID vaccines aren’t being recklessly “rushed” through development. We’re seeing what’s possible when research is properly funded and scientists are unshackled from the usual barriers to progress.",positive,0.908,0.0072,0.0848,,,,0,0,0,1331332016512536577
covid-vaccine-australia,VicVicm2, https://twitter.com/VicVicm2,2020-11-24 05:20:19,https://twitter.com/i/web/status/1330954347476258816,"Covid: Vaccination will be required to fly, says Qantas chief https://t.co/2X9Ib7gQtd",neutral,0.03926,0.23317,0.72757,Victoria,,,0,0,0,
covid-vaccine-australia,Roddlez1, https://twitter.com/Roddlez1,2020-11-22 17:44:01,https://twitter.com/i/web/status/1330416732146524160,The Covid vaccine had better be effective and embraced otherwise Australia’s borders can never be safely opened ever again. #TheProjectTV,neutral,0.09096,0.22985,0.67919,,,,0,0,0,
covid-vaccine-australia,ShaunNewman2, https://twitter.com/ShaunNewman2,2020-11-23 07:48:08,https://twitter.com/i/web/status/1330629162206257153,"WHO warns of a third coronavirus wave in Europe | The New Daily https://t.co/cpDLn7nJ0S and we in Australia are not immune to a third wave either, we must retain social distance and preferably mask wearing until a vaccine is found.",negative,0.03329,0.56486,0.40185,Queensland,,,0,0,0,
covid-vaccine-australia,PhillipLayton, https://twitter.com/PhillipLayton,2020-11-24 18:01:52,https://twitter.com/i/web/status/1331145999457288192,So vacination is not mandatory...you just won't be able to do ANYTHING if you don't get it...this is just the beginning... Qantas will ban travellers who don't have the COVID vaccine — can other businesses follow suit? https://t.co/dlc5FY6bNX,negative,0.00565,0.78459,0.20975,,,,0,1,0,
covid-vaccine-australia,PhillipLayton, https://twitter.com/PhillipLayton,2020-11-24 18:16:27,https://twitter.com/i/web/status/1331149669725036544,2000 left leaning millenials are hardly indicative of the thoughts of the majority of Australians... COVID-19 vaccine attitudes differ in Australia as experts say we're at a 'precarious time'  https://t.co/L3GCVwFn9V,neutral,0.04693,0.17153,0.78154,,,,0,0,0,
covid-vaccine-australia,njlintern, https://twitter.com/njlintern,2020-11-24 12:09:55,https://twitter.com/i/web/status/1331057427446329345,"RT @AFP: International air travellers will need to be vaccinated against Covid-19 to fly with Australia's Qantas, the airline's CEO has sai…",neutral,0.04844,0.43586,0.5157,Queensland,,,0,0,0,1331039450793713665
covid-vaccine-australia,UQHealth, https://twitter.com/UQHealth,2020-11-23 15:34:23,https://twitter.com/i/web/status/1330746497957195778,Thank you @couriermail for acknowledging the tremendous commitment and collaboration behind #UQ's #COVID19 vaccine team.🧪🔬👏👏👏👏 https://t.co/sKNxqfAGWE,positive,0.96158,0.00438,0.03404,,,,0,0,0,1330429499477954560
covid-vaccine-australia,TraceyLeeHolmes, https://twitter.com/TraceyLeeHolmes,2020-11-24 15:19:15,https://twitter.com/i/web/status/1331105074194485248,You can read the informed responses of a number of experts and officials here https://t.co/ZIwGUOjfAC,positive,0.65573,0.023,0.32127,,,,0,0,0,1331104398634676225
covid-vaccine-australia,LukeSlawomirski, https://twitter.com/LukeSlawomirski,2020-11-23 22:48:20,https://twitter.com/i/web/status/1330855704509378560,@LRussellWolpe @stephenjduckett Is our health data infrastructure up to the task?   https://t.co/AF0aB9yq9P,neutral,0.01153,0.4731,0.51537,,,,0,0,0,1330757829582471169
covid-vaccine-australia,LukeSlawomirski, https://twitter.com/LukeSlawomirski,2020-11-25 11:34:48,https://twitter.com/i/web/status/1331410980589379584,"No-fault compensation can help manage the fallout from adverse medical events ... but now would be the worst possible time to introduce one.   ‘No vaccine is 100% safe, so shouldn't Australia have a compensation scheme?’ https://t.co/Y2npoM5UYQ @AmberMaySchultz",negative,0.00719,0.98562,0.00719,,,,0,0,0,
covid-vaccine-australia,OZmandia, https://twitter.com/OZmandia,2020-11-24 06:46:20,https://twitter.com/i/web/status/1330975997395496960,COVID 19 Vaccine to be mandated if you want to fly QANTAS internationally #Australia #COVID19  @FatEmperor @dramerling @NahasNewman @kyotolover89  Here we go! QR Code tattoos next I guess https://t.co/WPRGy5mwfx,negative,0.02902,0.49171,0.47927,New South Wales,,,0,1,0,
covid-vaccine-australia,OZmandia, https://twitter.com/OZmandia,2020-11-25 11:01:37,https://twitter.com/i/web/status/1331402627498659840,"@GemmaTognini @Qantas Qantas Airways said Monday a Covid-19 vaccination will be a necessity for its international passengers. Chief Executive Officer Alan Joyce told Ch 9 in Australia he has discussed the idea with other airlines, and it’s likely to become a pre-boarding requirement around the world",neutral,0.13672,0.22059,0.64269,New South Wales,,,0,0,0,1331401936013287425
covid-vaccine-australia,writtenword09, https://twitter.com/writtenword09,2020-11-24 11:15:22,https://twitter.com/i/web/status/1331043700349100033,International visitors and people departing Australia will need to provide proof that they've had the COVID-19 vaccination under new terms and conditions the Qantas CEO is implementing across the airline. https://t.co/tfbTCb24v3,negative,0.02087,0.54564,0.43349,Western Australia,,,0,0,0,
covid-vaccine-australia,news_australia, https://twitter.com/news_australia,2020-11-25 14:22:03,https://twitter.com/i/web/status/1331453067611361287,RT @HighWireTalk: Why injuries suffered from the COVID-19 vaccines need to be litigated in the NVICP https://t.co/RKeXiOjvwY,neutral,0.02784,0.33539,0.63678,,,,0,0,0,1331452911147225088
covid-vaccine-australia,fivestarmichael, https://twitter.com/fivestarmichael,2020-11-25 13:34:00,https://twitter.com/i/web/status/1331440976557203456,"RT @profamirattaran: Australia paired up with AstraZeneca.  They began making the vaccine locally weeks ago, even before knowing that it wo…",neutral,0.30835,0.0824,0.60925,,,,0,0,0,1331319472389406720
covid-vaccine-australia,rossleedham, https://twitter.com/rossleedham,2020-11-22 10:58:34,https://twitter.com/i/web/status/1330314697430740993,Really better read as international travel is unlikely to return to Australia until 2022 as we need a massive vaccine rollout not only here but globally to reduce infections.  https://t.co/G44ku2WC1f,negative,0.00341,0.90265,0.09395,New South Wales,,,0,0,0,1330312281138278405
covid-vaccine-australia,JanieWray, https://twitter.com/JanieWray,2020-11-24 16:19:33,https://twitter.com/i/web/status/1331120249769320448,"Foreign visitors to Australia in the future will need to be vaccinated against COVID or will be forced to quarantine, @GregHuntMP has warned. #auspol @JoshButler reports.  https://t.co/Qb4BHJGt5Q",neutral,0.05989,0.36442,0.57568,,,,0,0,0,1331119231623114752
covid-vaccine-australia,7NewsPerth, https://twitter.com/7NewsPerth,2020-11-24 11:28:41,https://twitter.com/i/web/status/1331047049987407873,"Australia could have an effective COVID vaccine ready by March 2021, with Federal Health Minister @GregHuntMP praising the promising new results for the Oxford University vaccine. @olivialeeming #auspol #7NEWS https://t.co/PnsN3c2miR",positive,0.84786,0.0143,0.13785,Western Australia,,,0,3,0,
covid-vaccine-australia,Radar_Report, https://twitter.com/Radar_Report,2020-11-23 17:00:00,https://twitter.com/i/web/status/1330768044327485440,Australia's COVID bubble enables us to live relatively freely. South Australia shows that it can easily be punctured. A vaccine is coming but key measures like JobKeeper propping up the economy are ending. What does this mean for investors? https://t.co/4ohh7s8IRd,neutral,0.09069,0.22089,0.68842,,,,0,1,0,
covid-vaccine-australia,a_acko, https://twitter.com/a_acko,2020-11-25 11:09:17,https://twitter.com/i/web/status/1331404557121847300,"OK folks, let’s get something straight. COVID vaccines aren’t being recklessly “rushed” through development. We’re seeing what’s possible when research is properly funded and scientists are unshackled from the usual barriers to progress.",positive,0.908,0.0072,0.0848,Western Australia,,,0,0,0,1331332016512536577
covid-vaccine-australia,AnotherShitlord, https://twitter.com/AnotherShitlord,2020-11-24 11:26:07,https://twitter.com/i/web/status/1331046405322936320,"RT @UKTwinds: We have made a company decision today to not sell any @Qantas flights, even on a code share, following their announcement of…",negative,0.00563,0.91393,0.08044,,,,0,0,0,1330927922362933250
covid-vaccine-australia,Griffith_Uni, https://twitter.com/Griffith_Uni,2020-11-24 18:10:24,https://twitter.com/i/web/status/1331148147255492608,‘I believe we’ll start rolling out a vaccine by January here in Australia’ says #COVID19Aus expert Professor Nigel McMillan @MenziesHealth. ‘Imaging the future: After the pandemic’ conversation underway at @hota and live-streamed https://t.co/FqpE5FUtOB,positive,0.54765,0.02756,0.42479,Queensland,,,0,9,0,
covid-vaccine-australia,ArnoldSue, https://twitter.com/ArnoldSue,2020-11-24 05:56:48,https://twitter.com/i/web/status/1330963531307442176,Qantas to only accept passengers who have had coronavirus vaccine https://t.co/xNL3yaiTkE,neutral,0.03943,0.47202,0.48855,,,,0,0,0,
covid-vaccine-australia,roykf, https://twitter.com/roykf,2020-11-25 08:21:38,https://twitter.com/i/web/status/1331362366936629248,"Pauline Hanson slams ‘unacceptable’ Qantas vaccine rules, as other airlines follow suit | The New Daily AUSTRALIA APPLAUDS MS. HANSON FOR BEING READY TO DIE FOR HER RATTY BELIEFS https://t.co/FSOnBQi7zj",negative,0.03435,0.6787,0.28694,,,,0,0,0,
covid-vaccine-australia,whits106, https://twitter.com/whits106,2020-11-24 15:56:53,https://twitter.com/i/web/status/1331114547826941956,Not to mention the fact that there is already other vaccination conditions regarding entry &amp; re-entry to the country in place from the Aus Gov; and that COVID-19  vaccination is likely to also be a condition.,negative,0.02244,0.56522,0.41234,,,,0,0,0,1331113848993054721
covid-vaccine-australia,Lili_Mush, https://twitter.com/Lili_Mush,2020-11-25 08:26:19,https://twitter.com/i/web/status/1331363544751718401,"OK folks, let’s get something straight. COVID vaccines aren’t being recklessly “rushed” through development. We’re seeing what’s possible when research is properly funded and scientists are unshackled from the usual barriers to progress.",positive,0.908,0.0072,0.0848,,,,0,0,0,1331332016512536577
covid-vaccine-australia,TheRealHirsty, https://twitter.com/TheRealHirsty,2020-11-22 17:06:38,https://twitter.com/i/web/status/1330407324247228417,Wallabies from Australia have gained a foothold in the U.K. and may be there for good | CBC Radio https://t.co/H3hKEIiRDk,positive,0.65629,0.01624,0.32747,New South Wales,,,0,0,0,
covid-vaccine-australia,gordon_white, https://twitter.com/gordon_white,2020-11-22 07:36:09,https://twitter.com/i/web/status/1330263757428314115,Wallabies from Australia have gained a foothold in the U.K. and may be there for good https://t.co/jkZpKq4em9 https://t.co/u2wzvnF8QR,positive,0.73654,0.01065,0.25281,,,,0,36,0,
covid-vaccine-australia,lunarmobiscuit, https://twitter.com/lunarmobiscuit,2020-11-24 04:53:35,https://twitter.com/i/web/status/1330947623092514816,"RT @BBCWorld: International air travellers will, in future, need to prove they have had Covid-19 vaccine in order to board Qantas flights,…",neutral,0.01419,0.46576,0.52005,Western Australia,,,0,0,0,1330928947413078018
covid-vaccine-australia,BloombergAU, https://twitter.com/BloombergAU,2020-11-22 16:01:59,https://twitter.com/i/web/status/1330391053258665989,"Trial successes have buoyed hopes that a Covid-19 vaccine is coming soon. But much of the world, outside of rich nations like the U.S., is counting on another company’s shot to escape the crisis https://t.co/kfZ48uTFCU",negative,0.04821,0.51258,0.4392,New South Wales,,,0,1,0,
covid-vaccine-australia,BloombergAU, https://twitter.com/BloombergAU,2020-11-23 00:56:25,https://twitter.com/i/web/status/1330525548259516416,"Efforts to speedily develop and distribute a coronavirus vaccine in the U.S. won’t be derailed by a change in administration, said the head of Operation Warp Speed https://t.co/Rt9gmHDIjN",positive,0.74223,0.02732,0.23045,New South Wales,,,0,1,0,
covid-vaccine-australia,BloombergAU, https://twitter.com/BloombergAU,2020-11-23 14:14:10,https://twitter.com/i/web/status/1330726309065084928,The dollar drops to a two-and-a-half year low as plans to roll out a coronavirus vaccine in the U.S. bolster appetite for risk assets https://t.co/5BxySdfGm7,positive,0.48636,0.12933,0.38431,New South Wales,,,0,2,0,
covid-vaccine-australia,BloombergAU, https://twitter.com/BloombergAU,2020-11-23 17:28:28,https://twitter.com/i/web/status/1330775208274391041,A Covid-19 vaccine developed by the University of Oxford and AstraZeneca prevented a majority of people from getting the disease but fell short of the high bar set by Pfizer and Moderna https://t.co/kKNEYah9dn,neutral,0.06024,0.26333,0.67644,New South Wales,,,0,1,0,
covid-vaccine-australia,BloombergAU, https://twitter.com/BloombergAU,2020-11-23 22:00:20,https://twitter.com/i/web/status/1330843622888124417,2021 could be the year when U.S.-China ties stabilize and a vaccine draws a long-awaited line under the Covid crisis https://t.co/yZHPEUtxHF,positive,0.733,0.01135,0.25564,New South Wales,,,0,0,0,
covid-vaccine-australia,BloombergAU, https://twitter.com/BloombergAU,2020-11-24 00:06:05,https://twitter.com/i/web/status/1330875270694391810,The trio of coronavirus vaccines racing toward approval may reach the masses too late to prevent another round of airline failures https://t.co/2ERuIvu8vw,negative,0.00258,0.89849,0.09893,New South Wales,,,0,0,0,
covid-vaccine-australia,BloombergAU, https://twitter.com/BloombergAU,2020-11-24 03:25:30,https://twitter.com/i/web/status/1330925455277494272,Results from a crucial study of AstraZeneca and Oxford’s Covid-19 vaccine drew a harsh review from at least one sell-side analyst as Wall Street https://t.co/ORnxdnaAgZ,negative,0.05525,0.50089,0.44386,New South Wales,,,0,0,0,
covid-vaccine-australia,BloombergAU, https://twitter.com/BloombergAU,2020-11-24 06:06:28,https://twitter.com/i/web/status/1330965965010595840,Global airline lobby IATA is joining a push to introduce so-called Covid travel passports as vaccines for the disease near approval. https://t.co/1671pxJVmu,neutral,0.16962,0.25117,0.57921,New South Wales,,,0,0,0,
covid-vaccine-australia,BloombergAU, https://twitter.com/BloombergAU,2020-11-24 09:35:33,https://twitter.com/i/web/status/1331018580822003712,"Qantas plans to require future international passengers to have a Covid-19 vaccination before they fly, and said it’s likely to become a “necessity” for other airlines as well https://t.co/DvjK5PE4EB",neutral,0.28216,0.34766,0.37018,New South Wales,,,0,0,0,
covid-vaccine-australia,BloombergAU, https://twitter.com/BloombergAU,2020-11-24 12:30:00,https://twitter.com/i/web/status/1331062482983587840,The surging coronavirus is stoking fears of a fresh downturn for the world economy https://t.co/bBliNxdd6M,negative,0.11982,0.44344,0.43674,New South Wales,,,0,0,0,
covid-vaccine-australia,BloombergAU, https://twitter.com/BloombergAU,2020-11-24 17:11:20,https://twitter.com/i/web/status/1331133280985485312,"The development of Covid-19 vaccines has been faster than the Bank of England assumed when it compiled its latest forecasts and could brighten the outlook, policy makers say https://t.co/E6NVv4BrlM",positive,0.88906,0.01436,0.09657,New South Wales,,,0,0,0,
covid-vaccine-australia,BloombergAU, https://twitter.com/BloombergAU,2020-11-24 21:06:25,https://twitter.com/i/web/status/1331192444331888641,Uncertainty is swirling around one of the front-runners in the race for a Covid vaccine https://t.co/t3vpA2TSRM,neutral,0.16291,0.10105,0.73603,New South Wales,,,1,0,0,
covid-vaccine-australia,BloombergAU, https://twitter.com/BloombergAU,2020-11-25 07:46:21,https://twitter.com/i/web/status/1331353488098463750,The dose of AstraZeneca's Covid vaccine that showed the highest level of effectiveness was tested in a younger population than a bigger dose that showed less efficacy https://t.co/DVq3B6c0eT,neutral,0.07415,0.29462,0.63123,New South Wales,,,0,0,0,
covid-vaccine-australia,NonCorePromise, https://twitter.com/NonCorePromise,2020-11-23 22:27:10,https://twitter.com/i/web/status/1330850376090669058,RT @AlexInAir: Latest: Qantas (the national airline of Australia) becomes one of the first airlines in the world to state that only passeng…,neutral,0.04892,0.40754,0.54354,Western Australia,,,0,0,0,1330849227489075201
covid-vaccine-australia,CricketnBeer, https://twitter.com/CricketnBeer,2020-11-25 06:30:43,https://twitter.com/i/web/status/1331334453818363904,"OK folks, let’s get something straight. COVID vaccines aren’t being recklessly “rushed” through development. We’re seeing what’s possible when research is properly funded and scientists are unshackled from the usual barriers to progress.",positive,0.908,0.0072,0.0848,,,,0,0,0,1331332016512536577
covid-vaccine-australia,Nipponfafa, https://twitter.com/Nipponfafa,2020-11-23 08:39:33,https://twitter.com/i/web/status/1330642099620900865,'We can have a reasonably normal life between now and a vaccine': epidemiologist  https://t.co/idwBfivnXm,neutral,0.15266,0.08848,0.75886,,,,0,0,0,1330641737212071936
covid-vaccine-australia,RiaMidge, https://twitter.com/RiaMidge,2020-11-24 19:52:43,https://twitter.com/i/web/status/1331173897266364416,"@emmakennytv @Qantas Hello, Australia here! We had 1 case of community transmission of Covid today, so we feel quite good about our Covid response. We won’t let you in without a vaccine- no matter who you fly with.  And we’re definitely cool with this, thanks for asking.",negative,0.03802,0.92395,0.03802,,,,0,2,0,1330988271698993152
